{
  "artifact_type": "kandoo.mode-b.layout-font-fingerprint",
  "artifact_version": "1",
  "field_positions": {
    "column_0": [
      0.0,
      0.138889
    ],
    "column_1": [
      0.138889,
      0.3125
    ],
    "column_2": [
      0.3125,
      0.486111
    ],
    "column_3": [
      0.486111,
      0.659722
    ],
    "payable_bbox_over_width": [
      0.371528,
      1.423611,
      0.201389,
      0.048611
    ]
  },
  "fingerprint_id": "e08-candidate-32fdcb2526ae94a831ec",
  "glyph_profile": {
    "format_version": 1,
    "grid": [
      10,
      14
    ],
    "profiles": {
      "payable": [
        {
          "geometry": [
            0.625,
            1.0,
            0.0,
            1.0
          ],
          "grid": [
            0.25,
            0.75,
            0.0,
            0.0,
            0.0,
            0.0,
            0.0,
            0.0,
            0.75,
            0.5,
            0.5,
            1.0,
            0.5,
            0.167,
            0.0,
            0.0,
            0.0,
            0.167,
            1.0,
            0.5,
            0.667,
            1.0,
            1.0,
            0.667,
            0.0,
            0.0,
            0.333,
            0.833,
            1.0,
            0.833,
            1.0,
            1.0,
            1.0,
            1.0,
            0.0,
            0.0,
            0.75,
            1.0,
            1.0,
            1.0,
            0.667,
            1.0,
            1.0,
            1.0,
            0.167,
            0.167,
            1.0,
            1.0,
            1.0,
            0.833,
            0.167,
            0.667,
            1.0,
            1.0,
            0.5,
            0.5,
            1.0,
            1.0,
            0.667,
            0.167,
            0.0,
            0.25,
            1.0,
            1.0,
            0.75,
            0.75,
            1.0,
            1.0,
            0.25,
            0.0,
            0.0,
            0.0,
            0.75,
            1.0,
            1.0,
            1.0,
            1.0,
            0.75,
            0.0,
            0.0,
            0.0,
            0.0,
            0.5,
            1.0,
            1.0,
            1.0,
            0.833,
            0.333,
            0.0,
            0.0,
            0.0,
            0.0,
            0.167,
            0.667,
            1.0,
            1.0,
            0.5,
            0.0,
            0.0,
            0.0,
            0.0,
            0.0,
            0.0,
            0.5,
            1.0,
            1.0,
            0.25,
            0.0,
            0.0,
            0.0,
            0.0,
            0.0,
            0.0,
            0.333,
            1.0,
            1.0,
            0.0,
            0.0,
            0.0,
            0.0,
            0.0,
            0.0,
            0.0,
            0.0,
            1.0,
            0.833,
            0.0,
            0.0,
            0.0,
            0.0,
            0.0,
            0.0,
            0.0,
            0.0,
            0.75,
            0.5,
            0.0,
            0.0,
            0.0,
            0.0
          ],
          "label": "۷"
        },
        {
          "geometry": [
            0.25,
            0.5,
            0.6667,
            1.1667
          ],
          "grid": [
            0.0,
            0.5,
            1.0,
            1.0,
            1.0,
            1.0,
            1.0,
            1.0,
            0.5,
            0.0,
            0.5,
            0.75,
            1.0,
            1.0,
            1.0,
            1.0,
            1.0,
            1.0,
            0.75,
            0.5,
            1.0,
            1.0,
            1.0,
            1.0,
            1.0,
            1.0,
            1.0,
            1.0,
            1.0,
            1.0,
            1.0,
            1.0,
            1.0,
            1.0,
            1.0,
            1.0,
            1.0,
            1.0,
            1.0,
            1.0,
            1.0,
            1.0,
            1.0,
            1.0,
            1.0,
            1.0,
            1.0,
            1.0,
            1.0,
            1.0,
            0.5,
            0.75,
            1.0,
            1.0,
            1.0,
            1.0,
            1.0,
            1.0,
            1.0,
            1.0,
            0.0,
            0.5,
            1.0,
            1.0,
            1.0,
            1.0,
            1.0,
            1.0,
            1.0,
            1.0,
            0.0,
            0.0,
            0.0,
            0.0,
            0.0,
            1.0,
            1.0,
            1.0,
            0.5,
            0.0,
            0.0,
            0.0,
            0.0,
            0.25,
            0.5,
            1.0,
            1.0,
            1.0,
            0.5,
            0.0,
            0.0,
            0.0,
            0.0,
            0.5,
            1.0,
            1.0,
            0.75,
            0.5,
            0.25,
            0.0,
            0.0,
            0.25,
            0.5,
            0.75,
            1.0,
            1.0,
            0.5,
            0.0,
            0.0,
            0.0,
            0.5,
            0.75,
            1.0,
            1.0,
            1.0,
            0.5,
            0.25,
            0.0,
            0.0,
            0.0,
            1.0,
            1.0,
            1.0,
            0.75,
            0.5,
            0.0,
            0.0,
            0.0,
            0.0,
            0.0,
            1.0,
            1.0,
            1.0,
            0.5,
            0.0,
            0.0,
            0.0,
            0.0,
            0.0,
            0.0
          ],
          "label": ","
        },
        {
          "geometry": [
            0.625,
            1.0,
            0.0,
            1.0
          ],
          "grid": [
            0.0,
            0.25,
            0.25,
            0.0,
            0.25,
            0.75,
            1.0,
            1.0,
            0.75,
            0.25,
            0.167,
            0.667,
            0.833,
            0.5,
            0.833,
            0.833,
            0.667,
            0.667,
            0.833,
            0.5,
            0.667,
            1.0,
            1.0,
            1.0,
            0.667,
            0.167,
            0.0,
            0.0,
            0.167,
            0.333,
            1.0,
            1.0,
            1.0,
            1.0,
            0.75,
            0.25,
            0.0,
            0.0,
            0.25,
            0.75,
            0.667,
            1.0,
            1.0,
            1.0,
            1.0,
            0.833,
            0.667,
            0.667,
            0.833,
            0.833,
            0.167,
            0.5,
            1.0,
            1.0,
            1.0,
            1.0,
            1.0,
            1.0,
            0.5,
            0.167,
            0.0,
            0.0,
            1.0,
            1.0,
            0.75,
            0.75,
            1.0,
            0.75,
            0.0,
            0.0,
            0.0,
            0.0,
            0.75,
            1.0,
            1.0,
            0.5,
            0.0,
            0.0,
            0.0,
            0.0,
            0.0,
            0.0,
            0.5,
            1.0,
            1.0,
            0.5,
            0.0,
            0.0,
            0.0,
            0.0,
            0.0,
            0.0,
            0.5,
            1.0,
            1.0,
            0.5,
            0.0,
            0.0,
            0.0,
            0.0,
            0.0,
            0.0,
            0.5,
            1.0,
            1.0,
            0.5,
            0.0,
            0.0,
            0.0,
            0.0,
            0.0,
            0.0,
            0.167,
            0.667,
            1.0,
            0.5,
            0.0,
            0.0,
            0.0,
            0.0,
            0.0,
            0.0,
            0.0,
            0.5,
            0.833,
            0.333,
            0.0,
            0.0,
            0.0,
            0.0,
            0.0,
            0.0,
            0.0,
            0.5,
            0.5,
            0.0,
            0.0,
            0.0,
            0.0,
            0.0
          ],
          "label": "۴"
        },
        {
          "geometry": [
            0.5833,
            1.0,
            0.0,
            1.0
          ],
          "grid": [
            0.0,
            0.0,
            0.0,
            0.25,
            0.75,
            1.0,
            1.0,
            0.5,
            0.0,
            0.0,
            0.0,
            0.0,
            0.333,
            0.833,
            0.833,
            0.667,
            0.833,
            0.889,
            0.333,
            0.0,
            0.0,
            0.333,
            0.778,
            0.5,
            0.167,
            0.0,
            0.167,
            0.556,
            0.333,
            0.0,
            0.25,
            0.75,
            0.667,
            0.0,
            0.0,
            0.0,
            0.0,
            0.0,
            0.25,
            0.5,
            0.5,
            1.0,
            0.889,
            0.5,
            0.167,
            0.0,
            0.167,
            0.444,
            0.833,
            1.0,
            0.5,
            1.0,
            1.0,
            1.0,
            0.833,
            0.667,
            0.833,
            1.0,
            1.0,
            1.0,
            0.25,
            0.75,
            1.0,
            1.0,
            1.0,
            1.0,
            1.0,
            1.0,
            1.0,
            0.75,
            0.0,
            0.0,
            0.333,
            1.0,
            1.0,
            1.0,
            1.0,
            0.667,
            0.5,
            0.25,